passport,first_name,last_name,job,date_of_birth,comment,postcode,gender,spending
694369456,ปัตถพงษ์,ถนัดรบ,ศิลปิน,1963-03-09,"กำไรซ่อนโน่นห่วงใยและทั่วชาว ฤดูคนตายหมดคู่ทุ่มหรือชูข้าง 
เคารพชุดนอนแถบชุดนอนงม บัดนี้คนไข้ไอโอเอสคำถามคนตายดองเฉยครอง 
ขุดคำสั่งแข็ง เทเลแกรมทรัพย์สินฉีดกลเมตตาแต่งเสรีภาพ ",75320,Female,10541
229512554,เมษา,ทันยุค,เจ้าหน้าที่รัฐบาล,1998-01-30,"น้ำเย็นกำเทเลแกรมฝาก ตะปูตีนอุปโภคโดยหยอกครูขี้ไคลเพลง 
ตำลึงไหนเชื้อโรคบันได กิโลเมตรยันทอดชาวแมลงบูด ดำแก้วไหนผีกเนื่องจากธนาคารก้าง ",21410,Male,13130
U96857223,พัชรพร,ตระกูลบุญ,ผู้จัดพิมพ์,2021-12-31,"ดูฝากร่มรื่นถางหน้ากาก คำสั่งรากแต่แม่พยาธิ 
ริมดึกพิพักพิพ่วนรถโดยสารหล่นซ่อน แมลงตัวเมียที่กิโลเมตรหนุนไค้หันศาสตร์ กิโลเมตรมะเขือเทศรู้จักอาสาฝากปากดังนี้ 
อิฐสหกรณ์ร่างกายท้องฟ้า ",75320,Male,11953
H26958060,ประจิน,ทวีเดช,นักสังคมศาสตร์,1943-01-20,"สีแข็งอัศจรรย์มิตรรสชาติดึกหมัด 
ดีแพ้คำถามสถานีร่างเชื้อโรค โตเข้ารหัสกะละมังจัดผลคอก ปิ่นโตซ่อนรถโดยสารโง่ 
ตกลงโกงกะเพราที่กิ่งไม้เลี้ยว แก้ท้องฟ้าตรวจ ",95840,Female,12285
144271331,กิติวัฒน์,บุญญาไลย์,ศิลปิน,1960-11-25,"กิ่งไม้ไข่พับกว้าง ยาเขยื้อนสำหรับแกสดชื่นโรงสีแม่ 
ทอดกระถางต่อแกะเคย กะเพรากิโลเมตรขนมกตัญญู แข็งหมัดทาน 
ท้องฟ้าข้างมิตรเหตุวาดประชาธิปไตย ชูวินโดวส์เมตตาลูกก้าง ทดแท็บลอยด์เรื่อยกูเกิลเช้าถาง ",95840,Male,10399
N39834493,อภิลักษณ์,เธียรายัน,อาจารย์,1983-11-20,"ลูกเพดานเยอะ ตู่ค่อยคนไข้ช้า ครูยาถางผิด 
ตับคนตายง่วงกล้าฉีด เรียงกลเริ่มย่อพิพักพิพ่วนพิการ 
ห่อข้าวแท็บลอยด์คะแนนอวัยวะหายชนิดระยำ ",21410,Female,10341
Z92371159,ยศพนต์,นิลเสนา,นักการศึกษา,1966-01-15,"ไชโยรัฐประหารขัดหมอกเศรษฐกิจของหวานทวด โกงสีเทาเรียงเศษอาหารผลตีนซ่อนประชาธิปไตย เล่มเชื่อทอดมันกูรังแกเขยิบ 
แมคในเนื่องจากทุ่ม อบอุ่นคั่วทอดเนื้อรังแกพักผ่อน กล่าวห่วงใยแต่ขันน้ำ ",98860,Male,10971
267835810,ทิพย์วารี,นกทอง,นักดาราศาสตร์,1967-01-10,"เนื่องจากนิ่มเสียบขี้ดิน กบกตัญญูปาก 
โดยกะเพราดอกไม้ 
เคเอฟซีแข็งอ่อนหวานไต้หวันไชโยโรงสี แรงงานแสงแท็กซี่ประพฤติเข้ารหัสห่มผ้า ดูกลคนไข้นักเรียนปู 
ได้แก่สหกรณ์ข้าวเจ้า ",88530,Female,10648
T26042880,ศภัคชคง,หนักแน่น,ผู้กำกับภาพยนตร์,1986-05-20,"แม่มดลูกบริษัทคำถามโง่วาด ลืมคาวไหนดำจะไปพั่งดาวเทียมหรือ 
หม้อกลางแหย่ห่วงใย หึงสาถางบัดนี้แจ่มใสง่วง กว้างเบียร์อธิษฐานตื่นตกลง 
เฉยแซงกบทาน ออนซอนเด๊หม้อหมดที่ กำไรหมีตั้งแต่ไหนขี้ไคลเคารพต่อ ",75320,Female,9142
195100847,คำมั่น,เขียวอ่อน,นักโภชนาการ,1978-06-07,"หล่นตรวจทวดพิพักพิพ่วนบอกจัดเขยิบห่วงใย ย้ำคลานปูประพฤติ 
ตั้งแต่พยาธินุ่นแรก กตัญญูกลางคืนเทเลแกรมแปรงผลิตง่วงหุ้ม ไอศกรีมอิฐแก้แคะวิกิพีเดียกลางกีฬา ",75320,Male,11269
U47456842,เถลิงยศ,ดาบเพ็ชร์,เจ้าหน้าที่รัฐบาล,1964-03-11,"แจ่มใสน้าขุดอดหนู 
ไข่เผื่อโตเย็น วาดมะเขือเทศตำลึงต้นรัฐประหารหมอกเอิด กระถางซ่อมเบิ่งนักเรียนการอบอุ่น 
บอกใบ้กล้าแอนดรอยด์ลงมือหลังคาอิสลามโตยกรรมการ ชุดนอนซอยง่วงหรือ จากชาวก้าง ",66330,Female,9368
689108415,อาภัศรา,ถนัดอาวุธ,นักแปล,2014-01-03,"ขนมชั้นปีผลิตหาม้ายวินโดวส์ เยอะรถบัสเชื่อมหรือศาสตร์ 
หอยลืมคาววัฒนธรรมต้นโกงแผนที่ 
เกมโควิดในเหตุอ่อนหวาน เป็นขี่สมาคมคนไข้อนุบาลบาด 
เป็นใจเลือกตกลงใบไม้เพราะ ",22730,Male,11646
802657514,เกียรติศักดิ์,ศรทอง,นักพจนานุกรม,1951-10-12,"หุ้มยูทูบสมาคมอวัยวะเสียบคะแนนเปลืองง่วง และโก๋แก่หมัดกลผลคู่ 
คำสั่งอบอุ่นทวดเย็นข้างแสงช้า 
ปี่นิ่มผลิตรัฐบาลแต่บอก บริษัทไอศกรีมลูกชิ้นกูเกิลทุ่มหนุน เชื่อกิจกรรมเกาหลีทอดมันแกย่อหม้อ ",66330,Female,8770
D94824083,สมเกียรติ,เยาวธนโชค,นักแปล,1996-11-16,"ขี้ไคลทอดแรกและเป็นฝากชาวนาคาว ระเบียงห่มผ้าประพฤติไอโอเอสกูอัศจรรย์และผลัด 
สบายที่ดินขี้ไคลตรวจในลงมือตะแกรง 
คอมมิวนิสต์ปีคำถามวิ่งชาวอิฐกว้าง สม่ำเสมอวังค่อยแต่ผู้ร้ายจ๋า ",41560,Male,10346
444399422,มนรัตน์,นาคะนคร,นักมายากล,2012-03-13,"กล่องกลางคืนอิสลามแกะ สบายทรัพย์สินเทเลแกรมชนิด หมดคอมมิวนิสต์กตัญญูเขยื้อนคมนาคม 
เคารพสหกรณ์ของหวานแม่เศษแม่มดอาสาสำนักงาน ใบไม้หาม้ายคอกคำสั่งทอดแถบบูดหม้อ ",95840,Female,9095
508076215,พีรภัทร์,ไทนิยม,นักเขียน,2009-08-08,"เทเลแกรมและแพ้กลางคืนกำไรกตัญญู ใหม่เรียงต่อ 
ชุมนุมแคะแอนดรอยด์ย้ำอินเทอร์เน็ต ตอใดศาลากลางข้าวเจ้ามิตร แสงเงาไชโยใหม่เย็น รถโดยสารดาวเทียมวินโดวส์เสรีภาพ ",66330,Female,8780
L74379668,อัญพัชร์,บัวเผื่อน,นักสัตววิทยา,1910-04-16,"จ๋าสดชื่นถึงวิกิพีเดียชนิดขนมสำหรับ ออนซอนเด๊ผลธาตุตะแกรงชุดนอนฝากบัดนี้ 
อวัยวะยีราฟเงาช้าเย็บ ห่มผ้าเกมหน้ากากเนื้อล่อตัวอย่าง 
กระจายเบียร์อิฐโรงสี บริษัทแอนดรอยด์มัสยิดลูกการ หมีเจ็บไข้หลบขี้ดิน ",57110,Male,13047
G85783919,วาร์มูฮำหมัด,ศรีอุ่น,นักการศึกษา,1935-08-29,"วาดเศรษฐกิจซ่อนผู้ร้ายพนมมือ หาม้ายแข้งแมลงรถบัส บัดนี้แก้ริมเช้าแปรงกระจายเสรีนิยม 
องค์ตำลึงร้อนขุดเศษอาหารพับสถานีนิ่ม สถานีเตากูเกิลกล่องขันน้ำคลานหาย ",21410,Female,9355
740978160,ปิยวดี,ถนัดรักษา,ภัณฑารักษ์,1925-03-03,"ริมเสียบแต่ง ค่อยกล่องเปลืององค์กล้าแท็บลอยด์ใบไม้ 
กิจกรรมอายุแตะงมโน่นแมลง ชิงหลบแก้วหลงเป้าเชื่อ 
ฤดูทดลองสีเทาระเบียงหล่นชู หนุนอ่อนหวานอธิษฐานซี่เสียบคบทวิตเตอร์ ",98860,Male,11300
C08061740,คมกฤชญ์,ธัญเสถียร,คนขับรถแท็กซี่,1930-04-17,หน้าต่างแก้วอ่อนหวานดี ชุดนอนองค์น้ำเย็นวิชาชีพกิจกรรมกิจกรรม หาบเครื่องบินทวิตเตอร์นักเรียนก้างห้องเรียนดี ,57110,Female,8159
806675950,โอภาส,ดิศดใน,คนขับรถแท็กซี่,1998-05-17,"จะไปพั่งเรื่อยกับกำย่อนั่ง เคารพปูดังนี้แต่ ครองโดยดึกพนมมือกับผีกแผนที่ 
เงาทวดทดพ่อหนุนแต่ เข้ารหัสแตะผ่อสำหรับพับปี่ทรัพย์สินแถบ ",75200,Male,12136
Z09982249,กวาง,ยางสวย,เจ้าหน้าที่รัฐบาล,2019-11-30,"หาบเริ่มจัดคอกแท็บลอยด์ปกครองครองดอง เกมบริษัทศาสตร์จ๋ามอบ ข้าวโน่นคนตายสำนักงานผลิตสดอิฐค่อย 
ไหนก้างอิสลามเข้ารหัส ซ่อนเรียงปี่โกงทำสวนช้า เอสซีบีมิตรเคารพเริ่มแรงงานกลางคืนทวด ",21410,Female,9047
R66265566,รัฐพงษ์,ธรรมนิยม,นักสังคมศาสตร์,2007-07-01,"ทวดตัวอย่างสหภาพถกเถียงโตร้อนทุ่ม ไอโอเอสสหกรณ์บันไดค่อย ห้างทั่วกิ่งไม้ใบไม้กตัญญูเตียนตัวเมีย 
องค์ไต้หวันล่อตับโดยยาตรวจ ผ่อดูยาแซง ชาวกล้าคมนาคมจ๋าหึงสาหลงเชื่อ น้ำหวานเยาวชนสลับผสมคบ ",57110,Female,10804
358736715,นวรรษนันท์,ศรีวงค์,ผู้กำกับละครโทรทัศน์,1995-03-26,"การชุมนุมตกลงบัดนี้แมค หลงครูเตียนสหกรณ์สหกรณ์สุดท้ายเกาหลี กำไรเดี่ยวประชาธิปไตย 
ผีกยีราฟคลานคนไข้ โน่นไหนสนองร่มรื่นผู้ร้าย สดแรงงานอาสาสนองเพราะ บาดสถานีกระถางสนองขนมชั้นช้าทาน 
แม่เตาเศษปี ",22730,Female,12442
U49926803,คำ,เตชะกำพุ,แพทย์,1951-12-19,"ฉีดหมียูทูบกลางคืนชูลงมืออด คอกตรวจกูเกิล กบเศรษฐกิจแกสุขภาพผ่อหยอกข้าวหมูแดงตู้ 
ยากระจายริมสดชื่นรถบัสแตะแสง ชุดนอนข้าวหมูแดงอิสลามคาว ยึดดีห่มผ้าวิกิพีเดียนิ่ม ",22730,Male,11494
U39518212,สิริลัดดา,หอมพิกุล,คนขับรถแท็กซี่,2016-01-23,"เข้ารหัสคนตายที่ทดโตย มลายูเขยื้อนโน่นลูกสดเศษ 
เกมแท็กซี่เบียร์เมล็ดร่างกาย โดยปี่ชุมนุมกะเพราธาตุขุดกระจายหว่าน 
สมาคมหึงสาทอดมันกระจาย ชิงรถบัสหลบปูรถทัวร์ ขัดควรซอยแก้ว ",21410,Female,9284
P23778267,ณิชนันท์,ถาวรายุศม์,นักการกุศล,2016-02-27,"หว่านแรงงานฝากเยาวชนทุกข์ เมตตาล่ออนุบาลดีของหวาน 
ทวดรอเชื่อผักอาหาร คะแนนเอสซีบีขี่บอกแรงงาน 
อ่อนหวานกำไรแลกย้ำอุปโภคถึงผิด ครูสนองกินพยาธิแข็งน้ำหวานแม้ โรงสีจ๋าเบียร์ ",95840,Female,10386
X63991912,จินต์จุฑา,ถนัดรบ,นักโบราณคดี,1995-07-07,"ทำสวนนิ่มสบายตำลึงเคเอฟซี พยาธิสีเทาแกะรถถัง 
ไค้หันตู่ข้าวปีโก๋แก่หายเอิด ตำลึงแรงงานตับเสรีนิยมระเบียงวัฒนธรรมบันได 
แต่งหน้าต่างพับธาตุ หลงเจ็บไข้ด้าย ",75320,Female,12180
W49435316,จักรีรัตน์,กุมารบุญ,นักแปล,1984-04-03,"เห็นแปรงสมองโง่หนูอิฐแถบ คอกแท็กซี่ดอกไม้ตีนห่มผ้าตู้ 
สำนักงานจากไชโยห่อข้าว ที่ดินโรงสีทหารดองเช้า ชาวนามะเขือเทศใจนักเรียนจัดเยาวชน ",95840,Male,12121
547094949,ธีราทัต,ทวนทอง,เกษตรกร,1914-10-20,"นิ่มอัศจรรย์ล่อฤดูดังนี้ท้องฟ้ากิโลเมตร 
สลับเสียบโผล่ออนซอนเด๊ ขุดอวัยวะคำถามเสียบรังแกอ่อนหวานชะนี เกมสดบันไดแท็กซี่ปี่ง่วงขาดเคิ่งสบาย จ๋าถึงโตยนุ่นแพ้คบอิสลาม ",75320,Female,9453
119810381,โกมล,นิติสาขา,ช่างทำผม,1995-11-06,"รถบัสประชาธิปไตยพักผ่อนพ่อเปลือง เสรีภาพทำสวนเล่มหน้ากาก 
เรื่อยผู้ร้ายคนไข้ครองเพราะซอย เอิดกิโลเมตรทดลองกลางเดี่ยวสลับกิโลเมตร กระถางทวิตเตอร์อุปโภคไชโยหว่านยีราฟด้วยเล่ม ",21410,Male,11167
151937618,อินทรีย์,ถนัดพิมพการ,ตำรวจ,2009-12-24,"เคยซี่กามหยักกตัญญู ขันน้ำผักเยอะครูพิการอินเทอร์เน็ต 
ต่อใจกับดู 
ระยำอาสากล่องติด เป้าขาดเคิ่งโรงสีตับยันเอสซีบี ดำแรกกลางคืนหยอกเหตุปูฝากนักเรียน ",41560,Male,10324
Y14496170,ธัญญกัญญา,นวลเพ็ง,ผู้จัดพิมพ์,1996-08-12,พักผ่อนสาธารณรัฐเพลงตะปูสีลูกชิ้น คมนาคมหล่นกับทั่ว โควิดดึกกรดไหลย้อนกีฬาความบอกติดสุดท้าย ตกลงขนมแต่งโก๋แก่พักผ่อน ,75320,Female,7835
I96272316,จันทภา,แหยมศิริ,บรรณารักษ์,2017-06-28,"เอิดตีนแท็บลอยด์ไค้หันแพ้ ตู้ร่างช้าข้าวเจ้า 
ห้างทวดสำหรับแรก สดคนตายห่วงใยพิการริมทวด 
ไต้ทดรถถังแก้วในย่อแม่มดเพราะ อดทดลองเรียงห่อข้าวขี่ ",75320,Female,12121
S57607617,สุภัทริดา,ดำริห์ชอบ,ผู้กำกับละครโทรทัศน์,2000-09-01,"ล่อถางจะไปพั่งคอมมิวนิสต์ริมอุปโภค รัฐบาลเมาะแกสนองระยำหึงสา 
ถางวิ่งอิสลามผล เดี่ยวตื่นอายุเดี่ยวด้ายทวดสาธารณรัฐ ",95840,Male,11644
599830442,นัสรุน,ขอหมั่นกลาง,นักการทูต,1980-01-16,บอกใบ้หรือเริ่มขุดกำไรหนุน เล่มแรงงานหมอกเมตตากิ่งไม้ สดชื่นศาสตร์ศาลากลางทอดมันเยอะ ,57110,Female,8831
362557483,ดิลก,จ้อยนุแสง,นักการศึกษา,1925-02-13,"กบขี่ไต้อินสตาแกรมแม่มดหึงสา ลืมคาวโตยตู้รัฐบาลตอกปิ่นโตรสชาติอาหาร ฟากขี้ดินที่หน้ากากรถทัวร์โผล่ขาดเคิ่งบาด 
ดอกไม้ยูทูบจะไปพั่งเมาะแม่ 
ได้แก่ขันน้ำเกาหลีไค้หันขัด สุดท้ายกบกิ่งไม้กลผ่อมะเขือเทศ ",22730,Male,9056
426725446,กุลปรียา,นาควงษ์,นักสังคมศาสตร์,1968-08-15,"ชนิดโรงสีคำถามแข่งขันต่อ หน้ากากกล้าเอสซีบีโรงสี 
เกมสดชื่นสีดอกไม้อธิษฐานโต กล้าโรงสีตำลึงงมจะไปพั่งกิ่งไม้ มอบความรู้จักกล่าวตอใดรากไอศกรีม ",22730,Male,11944
V45532653,พันเทพ,ซาซุม,นักเขียน,1947-09-25,"โตยรสชาติเนื่องจากตับถึง ทั่วเมาะสุดท้าย สนองลูกชิ้นดึก 
ศิษย์แจ่มใสโน่นหลบทาน น้ำเย็นผสมบัดนี้เงา จะไปพั่งโตดาวเทียม 
ตู่โกงกว้างกรดไหลย้อนและแต่งกระถาง ซอยคาวสดชื่น ",75200,Male,12832
751261857,กรพนธ์,วิลาสินี,เจ้าหน้าที่รัฐบาล,2017-03-01,"เลี้ยวร่างกรรมการสบายเข้ารหัสอวัยวะฝากกระจาย โตกลางคอมมิวนิสต์อินเทอร์เน็ตห้องเรียน 
แอนดรอยด์ดึกองค์เศษอาหารตำลึงยาถึงเฟซบุ๊ก ตัวเมียหอยหล่น ",66330,Female,9913
P60602559,วรปรัชญ์,นิลสุวรรณ์,นักสังคมสงเคราะห์,1928-06-25,"ร่างประชาธิปไตยเริ่ม หมดแม่กะเพรา 
กระจายรอสนองดองขนมชั้น ไหนตู้ไอโอเอสเกาหลีวังหรือ คนตายห่มผ้าอายุคมนาคมอินเทอร์เน็ต 
กินข้าวเจ้ากินเศรษฐกิจกลางเงา ธาตุแก้วอธิษฐานซอยเนื้อกระถางตัวเมีย ",75200,Male,12565
420596838,เกษรา,ทองแท้,นักการทูต,1986-09-30,"น้ำเย็นดูแรงงานหล่น เลี้ยวฤดูไหน 
แปรงทวิตเตอร์อ่อนหวานบริโภค ประชาธิปไตยหลังคาที่ดินติดกูเกิลอาหารเลือกทวิตเตอร์ กิ่งไม้เงาแรงงานรถทัวร์รถถังอายุตลอดเห็น ",95840,Female,8840
818156714,นนทกาญจน์,บินดี,นักโบราณคดี,1945-01-18,"กรดไหลย้อนทวิตเตอร์หาม้ายแต่ ตะแกรงจัดได้แก่ครองเฉยโตยปู ลงมือกำแข็งชุดนอนแท็กซี่ย่อบันได 
ออนซอนเด๊เพดานเสียบฤดูกลตกลงสมอง พนมมือสาธารณรัฐธนาคารกระถางคำสั่ง ขี่ปีจ๋ารัฐบาลยูทูบตรวจ ",88530,Male,11754
