passport,first_name,last_name,job,date_of_birth,comment,postcode,gender,spending
Z30171116,เทอดศักดิ์,แหยมศิริ,ตำรวจ,2006-03-29,"ปูเมล็ดตกลงเพียง หอยทั่วดังนี้เกมเชื้อโรค 
แต่งปิ่นโตครูการชาวศิษย์ ทรัพย์สินดอกไม้คอกหยัก ร่มรื่นยึดแต่ตับ 
ไอโอเอสหน้ากากต้น เย็นแข้งแม่มดผสม น้ำหวานแสงการ กำดาวเทียมเลี้ยวค่อยชะนี ",95840,Male,11018
F52576460,สัญชาน,ผลบุญ,นักดาราศาสตร์,1932-11-30,"แข้งขนมพยาธิแผนที่ ยึดแข็งปากกลางรัฐบาลผู้ร้ายหว่าน พักผ่อนมอบร่างหลังคาแตะชุมนุมแถบ 
อธิษฐานสำหรับหล่นซี่หมอก หมัดแมคตื่นหอยเฟซบุ๊ก กรรมการตู้โน่นสลับต้นห้างเผื่อ ",75320,Female,11372
278166327,ประวี,ร่มธิติรัตน์,ผู้จัดพิมพ์,1984-01-03,"ประพฤติอาสาหุ้มตัวเมียใจกูเย็น เทเลแกรมเครื่องบินกรดไหลย้อนเยอะ 
ถึงอวัยวะออนซอนเด๊อินสตาแกรมระเบียง มิตรบริโภคทุกข์รถบัส เรื่อยสถานีสดชื่นอ่อนหวานมิตรบูชา ",95840,Male,13608
H91584687,ทรรศนชัย,ศรีอุ่น,นักพจนานุกรม,1999-12-11,"ดอกไม้ใจสุดท้ายไอศกรีมผีก คำถามเหตุชนิดของหวานอธิษฐานตั้งแต่ศาลากลาง 
สมาคมควรทรัพย์สินเนื้อ ดังนี้อาสากตัญญูแข่งขันโดยหุ้มมัสยิด 
โก๋แก่พักผ่อนศาสตร์พนมมือบอกใบ้ ฤดูเตาแท็กซี่แข้งหนูเยอะ ",98860,Male,11200
T80495872,ภารวี,แท่นทอง,แพทย์,2007-02-27,"ซ่อมเบิ่งเจ็บไข้เปลืองหาบ เชื่อไข่กตัญญูอนุบาลหอย 
เลือกทอดมันซ่อมเบิ่งเชื้อโรคแข้งแตะชาวนา เป้ากะเพราคอกปูบันไดแข็ง ลูกตาครูฝากห้างกะละมังเดี่ยวบอก ",22730,Male,8887
I69518573,ธีริสรา,เดชคุ้ม,นักคณิตศาสตร์,1992-07-26,"ชาวนาแหย่ขาดเคิ่งกล้า 
คนตายชิงแมลงสำนักงานคำถามสบายร้อนลงมือ ขี่ทดลองวัฒนธรรมกลครอง ชนิดอิฐถึงอาสา 
ไค้หันของหวานหม้อผีกชูคอก แม่มดหลังคาทหารเคเอฟซีโกงเยาวชนเกมหึงสา วิกิพีเดียหยักใบไม้ซอย ",66330,Female,9001
927242165,ภูวัน,ตัณสถิตย์,นักสังคมศาสตร์,1982-09-07,"ข้างเย็บครูเริ่มหึงสาเสียบหอย แม่กระจายหลงกระถาง แกแถบพักผ่อนด้าย 
กรดไหลย้อนแม่ไอโอเอสคาวหนู เคารพแจ่มใสสีแดงหน้ากากไข่ตะแกรงหลบ หอยกว้างครองอาสาเริ่มเยาวชนพิพักพิพ่วนแรก ",95840,Female,7965
550557384,ไชยภพ,ธนประทีป,ช่างทำผม,1986-07-30,"ต้นครูเขยื้อนเอิดโต 
กลางคืนไข่ทอดกามเข้ารหัส ศาสตร์ค่อยกิจกรรมโรงสีหลบ 
หอยไข่ฟากคอมมิวนิสต์ ร่างสุดท้ายแหย่คมนาคมประสบการณ์ไข่ล่อ 
สดชูลงมือจ๋า วาดเคารพเศษสำหรับข้าวหมูแดงย้ำแผนที่ ",88530,Male,12216
W04678363,วิรศักดิ์,ไทไชโย,นักแสดง,2022-07-13,"ด้วยอบอุ่นย้ำชนิดเพราะซี่ ชาวนาบันไดจ๋าฟาก 
ศาสตร์กิ่งไม้กว้างข้าวแม่วิกิพีเดียสีเทาทุกข์ ครูอดวิชาชีพผสมและเมตตา สนองเอสซีบีผลิตเผื่อครูของหวานเย็น 
ด้วยวินโดวส์กามอิฐคมนาคม เขยื้อนเศษอาหารกีฬา ",95840,Female,9468
444073264,คมสัน,พานเกล้า,ช่างทำผม,1993-12-24,"เยอะคบหาม้ายเคย และเป้าไต้หวันประชาธิปไตยอินเทอร์เน็ต ซี่เปลืองทวิตเตอร์กรรมการ นั่งของหวานเมล็ด 
เลือกบูชาเรื่อยร่มรื่นปิ่นโต สีเทาโผล่มัสยิดเชื้อโรคปิ่นโต ",88530,Female,9367
N34025019,อธิตยา,ถนอมพลกรัง,นักการกุศล,2009-03-17,"เนื่องจากกรดไหลย้อนดูนักเรียนทวด ถางบาดไค้หันทหารพักผ่อน เรื่อยนิ่มโรงสีเพียงดูแข่งขัน 
แต่งแรกเคารพอนุบาลซอยรถถัง ผสมเคยลืมคาวซ่อนตีน หนูแซงสุขภาพเยาวชนเพลงเชื่อมกว้าง ",66330,Male,10775
J70268612,นันทวรรณ,ดาวกระจาย,ช่างทำผม,1947-05-13,"เผื่อบาดเฟซบุ๊กอดมอบคมนาคมเปลือง เลี้ยวลูกตารู้จักก้างรู้จัก 
ประชาธิปไตยต่อทวด ชุมนุมท้องฟ้าขัดสีแอนดรอยด์พยาธิเพลง กระถางเผื่อทวดรากธาตุเดี่ยวต่อคมนาคม ",98860,Male,12842
V68276452,สิริลัดดา,ทองสุกเลิศ,คนขับรถแท็กซี่,1921-02-05,"ถึงบริโภคทุ่มแมลง เคเอฟซีไข่ไอโอเอสง่วงคนตายห่อข้าวระยำ กล้ากลางคืนนุ่นเสรีภาพความอิฐน้ำเย็น 
บูดหลังคาขี้ไคล กิจกรรมคลานชิงบันไดพักผ่อนคาวหมด ห่วงใยห่วงใยแท็กซี่ ",41560,Male,12523
V15958256,สโรชา,เมืองสุข,จ๊อกกี้,1929-12-30,"แข็งระยำแท็กซี่หมอก 
หน้ากากสดชื่นรถทัวร์ปูดึก เสรีนิยมก้างกิ่งไม้ยีราฟอินเทอร์เน็ตตัวอย่าง 
ตั้งแต่กลางประพฤติยันเพราะตอก 
หมอกแข่งขันหยักพิพักพิพ่วนหอย ",66330,Male,11547
C45989610,นาวีตา,ไทไชโย,ผู้กำกับภาพยนตร์,1983-05-12,"ของหวานนักเรียนปิ่นโตดำบูด สมองแกะเศษกามหึงสา แซงอาสาบันไดบันไดประชาธิปไตยมอบ 
เรียงสบายหม้อ ผลิตโกงรสชาติสม่ำเสมอไค้หันหลบที่ดินเหตุ หมุนอินเทอร์เน็ตองค์ตกลงทานกล่าว ",75200,Female,12914
Y38275855,นาตยา,แจ้งสว่าง,ผู้จัดพิมพ์,2010-03-04,"ซอยครูข้าวแปรงเนื้อที่หม้อ เพียงร่างยูทูบเผื่อหาบ 
อาสาสุดท้ายทุ่มประสบการณ์ง่วงครอง แท็บลอยด์ตู้วิกิพีเดียกล จ๋าลงมือฟากฟากสหกรณ์แก่ ",41560,Male,11659
O11434113,ทิมาภรณ์,ขำเอนก,จ๊อกกี้,1972-04-25,"ทอดมันลูกตาจ๋า ยูทูบจ๋าทอดประพฤติ 
ความขนมฤดูแมลงทรัพย์สิน อนุบาลดำบอกใบ้ถีบ 
เรียงอิฐเลือกไข่กระจายธนาคาร ประสบการณ์ครองซ่อมเบิ่งขี้ไคลตัวอย่างทำสวน ",41560,Male,11512
693593002,โสภณ,วาทา,อาจารย์,1966-08-25,"ขุดโดยชูยันดอกไม้ ประพฤติรถโดยสารต้นแท็กซี่ผลัดไอโอเอส 
หลงคะแนนพนมมือท้องฟ้า ยันของหวานคำถามร่มรื่นบันไดรถถังใบไม้ ตกลงโควิดย้ำน้องแมลงคาว ",75320,Male,10098
C40246313,พิชญ์สินี,ยะผา,นักการกุศล,1994-07-27,"หมีอาหารชาวยึด นุ่นคมนาคมในโกงรสชาติเทเลแกรม ที่ความสหภาพกิโลเมตรร่มรื่น 
เมตตาปีเอสซีบีหมอกสีเทาตำลึงดังนี้ ธาตุกล่าวกะเพรามอบน้ำหวานคู่ ผลิตชุดนอนแตะตะปูก้างซี่ ",95840,Male,13041
D83513218,ดารุนี,นรวิทย์โชติกุล,บรรณารักษ์,2025-04-27,"คบหลบชุมนุมพนมมือเกาหลี ง่วงหุ้มเพราะครอง 
ดึกแม้กิจกรรมรอหุ้มก้างชุดนอนแสง บอกใบ้เนื่องจากวัฒนธรรมซ่อมเบิ่งดีตอใด 
ซี่และแหย่เริ่มคอก วิ่งบริโภคตับแรก ",57110,Male,12666
R23822628,วิรศักดิ์,ศรีตะวัน,จ๊อกกี้,1943-07-09,"แถบโก๋แก่ชาวด้ายดี ไหนอาสานักเรียนคาวยันคำถามกะละมัง กว้างโผล่วาดตัวเมียโควิด 
อิสลามเพราะห้องเรียนที่ขุดไต้หวันวัง โรงสีกับแก่สีเทา หาบผลและน้ำหวานเศษอาหาร โง่เริ่มเมตตาสหภาพอัศจรรย์แม่มดเลือก ",22730,Male,11644
379504300,นิชนันท์,ธรรมนิยม,นักแสดง,1916-04-16,"คอมมิวนิสต์ตกลงทอดมันตู้โง่เกาหลีดี ตู้ดำผลเขยิบเศรษฐกิจแต่ กำไรฝากทำสวนไชโยเลือก 
พ่อกลกล้าอายุ เยอะมิตรเปลืองกล่าวคำถามริมกตัญญูเช้า 
แรงงานสุดท้ายแกะเศษคอก น้ามัสยิดติดที่ปกครองท้องฟ้าห้องเรียน ",66330,Female,9533
I11969264,ซูไรดา,ถิรสวัสดิ์,คนขับรถแท็กซี่,1988-04-24,"เปลืองทวิตเตอร์อ่อนหวาน ประชาธิปไตยดอกไม้นักเรียนน้ำเย็นแข็งฤดูศาลากลาง 
ดูแท็กซี่ไข่ครูด้วยเศษได้แก่ ทรัพย์สินเมาะสลับควร นั่งแกะคาวฤดู 
กระจายสดลงมือแก้ หายฤดูเล่มไอโอเอสร่างกายดอกไม้ ",22730,Female,10327
490382207,ธีราทัต,นาคพันธุ์,นักแสดง,1944-04-13,"พิพักพิพ่วนผักเป็น ต้นเครื่องบินถีบวัฒนธรรมบอกใบ้สมองล่อ ตั้งแต่น้ำเย็นทุ่มรู้จัก 
ทหารฟากฟาก เงาร่มรื่นลูกชิ้น ",98860,Male,11476
E38296030,บุญญกัลป์,นาถะพินธุ,คนขับรถแท็กซี่,1984-06-26,"นักเรียนศิษย์เอสซีบีแข็งด้วยกิจกรรม ชาวนามะเขือเทศผู้ร้ายสดห้องเรียน คบซ่อมเบิ่งบันไดเสียบสีแดงอินเทอร์เน็ตตู่ 
ประพฤติแท็กซี่ขนมริมเสรีนิยมชนิดโผล่ เลือกผีกหยักกตัญญูเรื่อยเลี้ยวร่มรื่นหมุน ",75200,Male,12051
052539564,พัชรพร,ยะผา,ศิลปิน,1936-04-03,"แก่เขยิบลูกชิ้นห่วงใยฝาก ขันน้ำหน้าที่ชุดนอนกลางคืนห่อข้าวแถบบาดยูทูบ ควรแก้วต่อมอบถีบ 
คนไข้ตู้ในเป็น กระจายประสบการณ์ห้างบริโภคหน้าต่าง ",22730,Male,13864
G83931863,กฤตพร,ทวนไชย์,นักดาราศาสตร์,1947-12-13,"แผนที่รากทอดมันด้วยหมัด เมล็ดสาธารณรัฐเกาหลีห้าง จ๋าตะปูอด เฉยยึดหอยผู้ร้ายแซงทหารอุปโภค 
กระถางเพลงแรกห้องเรียน แม่เป้าเพียงทอดมันเศษย่อกลางคืน หน้ากากกูกินโตยแหย่มัสยิดทานบัดนี้ ",41560,Male,12161
B63941521,นนทกาญจน์,ทุมะบุตร์,นักแสดง,2000-06-10,"เทเลแกรมประสบการณ์ประสบการณ์เจ็บไข้ได้แก่กิจกรรมบริโภค ยึดหลบนั่งเศษอาหารวิชาชีพ 
ดำย่อคนตายขัด ถกเถียงชะนีเศษอาหารค่อยไชโย สุดท้ายโก๋แก่กีฬายูทูบแต่ขี้ไคลหึงสา ",57110,Male,10342
739458772,นิมุ,แต้กุล,นักสังคมศาสตร์,1911-07-31,"รถโดยสารหมัดอนุบาลเคยเยอะหมุนรถถัง หาม้ายแคะของหวานสหกรณ์ซอยกล่อง 
ขันน้ำเสียบชิงผิดโกงห่มผ้าเมล็ดเรื่อย ต่อตอกน้ำเย็นคำสั่ง 
เพราะเมาะถกเถียงโกงอาหารชู 
ครูขาดเคิ่งตอกห่วงใยได้แก่ โตอิสลามได้แก่ ",95840,Female,9497
893718815,ธัชญา,เมืองสุข,เจ้าหน้าที่รัฐบาล,1958-05-19,"อัศจรรย์หนุนชุดนอนตัวอย่างสารวัตรไข่ 
เพราะซ่อนกลาง 
เคเอฟซีเย็บตำลึงผสมเข้ารหัส 
กำรัฐประหารวิ่งเบียร์ทดแรกอ่อนหวานฝาก สำนักงานสมาคมกิ่งไม้ ห่อข้าวธนาคารกีฬาหมี ",57110,Female,10056
671843944,นัฐพล,นรวิทย์โชติกุล,ผู้กำกับภาพยนตร์,1986-10-12,"วัฒนธรรมศาลากลางสำนักงาน วิ่งเตาหมัดประพฤติอัศจรรย์ไต้แก้ว 
ทรัพย์สินอินสตาแกรมปูวิ่งสถานี งมหมอกการห่อข้าวอัศจรรย์เดี่ยว ครองน้ำหวานดำ 
กับทวิตเตอร์เตียนกล่องแจ่มใสมัสยิดหยอก ย่อซ่อนร่มรื่นอาสา ",88530,Male,11365
Q96129836,วิทูลย์,ตรีครุธพันธุ์,จ๊อกกี้,1990-06-10,"ก้างย่อไหน ออนซอนเด๊เกาหลีแม่มดกะละมังชู ชาวนาทุกข์มอบด้วยปี่ศิษย์ธาตุ 
แหย่แตะช้าห้าง 
เข้ารหัสนั่งทุกข์ วาดอินสตาแกรมข้าวหาม้าย โก๋แก่รถบัสเอิดร่างกายร่างสำหรับความ 
โรงสีหว่านเนื่องจากกูหมี ",98860,Male,11923
W51517461,โสภณิตา,ภูภักดี,เกษตรกร,1916-02-22,"ดองแถบจะไปพั่ง แลกตื่นรัฐบาลกำไรผักเดี่ยว ซ่อมเบิ่งดาวเทียมฟากชุมนุม 
พนมมือเริ่มตับสดชื่นโตยเยาวชน หยักถีบศาลากลาง ฝากงมร่าง 
หยอกแพ้วิชาชีพ ปิ่นโตยีราฟคนตายไต้หวันคำสั่งคำสั่ง ",98860,Female,10221
796806599,วนาลี,นพตระกูล,อาจารย์,1976-03-24,"เฉยด้วยเอสซีบีแอนดรอยด์ศิษย์ อบอุ่นห่วงใยแม้กะละมังแกะ 
ฤดูข้าวเจ้ารากพิการแรงงานไข่ รถถังบริษัทง่วงศาสตร์สุขภาพเนื้อสำหรับเยาวชน เจ็บไข้สหกรณ์เสรีภาพด้วยเมาะโดยขี้ไคล ล่อคาวข้างชิงออนซอนเด๊ปี่ ",57110,Male,12507
Q30178227,สุภาลินี,โพธิสัตย์,เจ้าหน้าที่รัฐบาล,2004-05-08,"เข้ารหัสเงากลางคืนแซงอัศจรรย์ ตำลึงเป็นพับชะนี 
งมสนองหอยหมอกหมีสี ตื่นสัญญาขี้ไคลมัสยิดเริ่มหนูห่อข้าวคอมมิวนิสต์ ",98860,Male,11993
G33952013,ตรีนุช,วาทา,อาจารย์,1996-06-29,"ตอกงมรถบัสจากข้างด้ายสีเทาห่วงใย หน้าต่างหาม้ายชาวขันน้ำ ควรกระจายหุ้มกลาง แถบแม้หลบชนิดอธิษฐานเฉยขันน้ำ 
ตอใดกับกระจายชนิดการกิน กล่าวคำสั่งเสรีนิยมตอใดชะนีโน่นประชาธิปไตยสหกรณ์ ",75200,Male,10762
444420425,สมปอง,นฤภัย,นักการศึกษา,1954-10-09,"ไข่สารวัตรตกลง ธาตุลูกชิ้นกับวิชาชีพปีพิพักพิพ่วนแมลง 
ผสมเขยิบถางเผื่อตอใดเมล็ดฟาก คอกเสียบค่อยล่อลงมือสารวัตรดอง ",88530,Female,11564
041165055,อริสรา,ธรรมเมธา,ตำรวจ,1997-04-18,"แมลงครองย้ำเรื่อยไต้หวันแสง แต่งลงมือห่มผ้าเรื่อยเทเลแกรมกลางคืน 
ลูกชิ้นสดชื่นนั่งยันร่าง ขันน้ำเศษค่อยเตียนอิสลามเตา 
ปากทานเขยิบหม้อถีบซ่อนเมาะ ห้องเรียนแปรงไต้หวันยีราฟ อินเทอร์เน็ตร่างโกงเคย ",21410,Female,9560
161186802,รมิตา,นักสำหรวจ,ผู้กำกับละครโทรทัศน์,1977-06-16,"ผิดเชื่อแกะรถถังถึง โดยแม่ผ่อหม้อกว้างกรดไหลย้อนแข่งขัน 
ตับเตียนห้างเช้า คมนาคมกามที่สัญญา ชะนียีราฟซี่แผนที่ทำสวนทอดมันเมาะ ",57110,Female,9361
179781234,ศิรินันท์,ขอหมั่นกลาง,นักประวัติศาสตร์,1967-02-24,"เมล็ดเพียงดาวเทียมติดค่อยกำ ครองสารวัตรบัดนี้พักผ่อนก้างถกเถียง 
คนตายปากปากตีนหมี อินเทอร์เน็ตถกเถียงเนื่องจากอิฐ ",98860,Male,10143
R27522060,สุไฮลัน,บุญส่ง,ศิลปิน,1920-02-17,"เยาวชนรอศิษย์ไข่ผ่ออาสาทด ศาลากลางตัวอย่างเสรีภาพ 
การกระถางแมลง เรียงพับกลางอายุเงาหมัดเกม อินเทอร์เน็ตไชโยลูกเยอะน้า ",88530,Female,9587
239629852,คำ,ฉัตรอภิเที่ยงค่ำ,ผู้กำกับละครโทรทัศน์,1957-07-18,"เคยเป้าแก่ห่อข้าวฉีดชาวนา 
เย็นหน้ากากเปลืองสดผลัดพนมมือของหวาน อดรถบัสหน้าต่างเกาหลีเฟซบุ๊กเคยหลงผ่อ ชาวนาเยาวชนหนุนพับแม่ถีบเรื่อย 
โกงค่อยหาม้ายสมองโรงสีขนมชั้นผิด ต่อสุดท้ายแสงเจ็บไข้ ",95840,Female,9316
092977241,หล้า,ติระคมน์,ผู้กำกับละครโทรทัศน์,1983-07-20,"พิการคาวหยักตั้งแต่หมอกเปลือง สมองทหารเคเอฟซีเมาะ 
สดขันน้ำทอดเกาหลีผสมวิ่ง ตีนขัดสารวัตร 
งมแปรงดังนี้ขนมชั้นเชื่อทวิตเตอร์เริ่ม เสียบคั่วแมคศิษย์ ",57110,Male,12796
