passport,first_name,last_name,job,date_of_birth,comment,postcode,gender,spending
U88190667,ปัตถพงษ์,นาคพันธุ์,นักสังคมสงเคราะห์,2005-05-05,"วิกิพีเดียพักผ่อนวิ่งระยำตู้ชาวรัฐบาล หมุนชนิดหาบหน้าที่พับเมาะ ผ่อสมองคลานหน้ากากโกงแก่ซี่ 
ครูเจ็บไข้เหตุเคยหยักวัง ห่อข้าวไอศกรีมห่มผ้าแกคบมะเขือเทศเคย 
หลังคาผักสด เผื่อแข็งคาวหาบตะปูย้ำ ",95840,Female,10792
853285924,อุลัยพร,จันอ้น,อาจารย์,1937-05-28,"ยาเย็นเมาะ ค่อยเตาทำสวนหยอกตั้งแต่หนุน สบายชาวสม่ำเสมอบูดองค์ทหารจ๋าสาธารณรัฐ 
ก้างอินสตาแกรมลงมือ ผิดตื่นห้าง ซี่เพียงถาง 
อัศจรรย์ดำรอเช้าผลกบชะนี ท้องฟ้ารัฐบาลพิการหมุนรถบัสอาสาเลี้ยวข้าว ",66330,Female,11173
913184265,มารีนี,นิยมสำหรวจ,นักประวัติศาสตร์,1980-07-14,"รถบัสข้าวหมูแดงล่อพยาธิใบไม้ ฝากชุดนอนข้าวเศรษฐกิจ 
คาวไข่เนื่องจากศิษย์ เตาท้องฟ้าพิพักพิพ่วนหอยอด เสรีภาพเปลืองแพ้วิชาชีพ 
แมลงฟากแม่มดต่อ กำน้ากล้ารังแก ขาดเคิ่งสมองเลี้ยวที่ทุกข์ผู้ร้ายสมาคม ",98860,Male,10534
808877757,บุญพา,ถมังรักษสัตว์,นักการศึกษา,1979-11-13,"เนื่องจากน้ำหวานทั่วย่อ วินโดวส์เย็บสมอง 
รถบัสกลางแสงเมาะแกะรสชาติกล่องผิด 
หนุนเมตตาหมีแถบขี่กว้างความ เพราะพ่อองค์สีแดงฝาก คบโก๋แก่เมาะอินสตาแกรมห้างเพียง ",41560,Male,11904
462467164,ปาริตา,ถนัดหัตถกรรม,นักการศึกษา,1982-09-11,"เสรีภาพแม่อนุบาลผิด ชาวนาหอยชาวบูดถกเถียงบริโภค รัฐบาลด้ายเป็นกินหายแผนที่ชิง 
ซ่อมเบิ่งทุกข์แพ้กาม เอิดตับหลงกับโกงแข้งคำสั่ง วังครองสารวัตรหน้าที่สนองผลิตแถบ ",75320,Female,10620
069373098,พิพิธธน,ถนัดการเขียน,เกษตรกร,2019-02-01,"คอกแรงงานไข่ร่มรื่นเล่มถกเถียง รสชาติพิพักพิพ่วนหม้อบริโภค 
หนูจัดตลอดชาวนา 
กล่องหมอกน้ำหวานชาวนาโตยโง่ผิด เบียร์หยักทานผลัด 
ย้ำริมแข็งฟากวิกิพีเดีย โตผิดข้าวหมูแดงดังนี้ทำสวนแต่ หยอกท้องฟ้าตับย่อ ",75320,Female,8702
V02578108,ซูฮัยดา,สงประเสริฐ,นักแปล,2009-01-28,"ฝากน้องกว้างไค้หันเลี้ยวสถานียูทูบ หมดเฟซบุ๊กนั่งโตแผนที่คำถามขี้ไคล หาม้ายฉีดพับกลางคืน 
ตรวจเยอะคำถามข้าวหมูแดงชาว เพดานแก่เสรีภาพชุมนุมทอดผสมปิ่นโต 
ยูทูบทดองค์มลายู ",75320,Male,11289
Q34995779,วีระวัฒน์,ดีตพันธุ์,นักโภชนาการ,1921-07-22,"เงาข้าวเอิดง่วงเชื้อโรค ทหารด้วยเพราะผ่อเตียน ไต้ครองแก้ต่อ สีเทาแท็กซี่ปูทำสวนมลายูถกเถียงมะเขือเทศ 
ทอดมันชิงบอกแอนดรอยด์ ลืมคาวตรวจกลค่อยอินสตาแกรมกำ อนุบาลคำสั่งมลายูสถานีคู่ซ่อมเบิ่ง ",21410,Male,11689
J24336536,ชัญญานุนาย,อุลหัสสา,นักแปล,2008-07-04,"ยาจ๋าผีกกล้าใหม่อัศจรรย์ ตอใดแมคกินหน้าที่รู้จักกูใบไม้แข้ง เล่มก้างตะแกรงระเบียง 
ทุ่มพักผ่อนตับ ขุดลืมคาวบูดหม้อติด สุดท้ายกว้างเกม ",21410,Male,11579
058997989,วณัฐดา,นานายน,นักแสดง,2008-03-11,"สนองเคยเฟซบุ๊กกลางวัง ตรวจโก๋แก่เล่มพักผ่อนแปรงหมด 
แม่บริษัทตรวจเลือกไต้หวัน ได้แก่ดีวิ่งลืมคาว อิสลามรถโดยสารดีเศษวินโดวส์บันได บริโภคแม่สารวัตรลืมคาว 
หมุนห่มผ้ายึดกลางงม คบหล่นริมแกหน้าที่ ",41560,Male,11861
407853229,ณัฐติญา,ติระคมน์,ศิลปิน,1931-12-22,"ศาลากลางติดกิโลเมตรยึดกล่อง 
ธนาคารทวดแข็งตื่นแม่มดเนื้อคมนาคม ถึงน้ากิ่งไม้ลูกตา ถึงหลงตกลงเศษ 
บูดแพ้ผัก รถทัวร์เป้าน้องเลือกทำสวนเคเอฟซีพยาธิ 
ชาวนาเขยื้อนปากสำหรับหล่น ซ่อมเบิ่งเขยิบเรื่อย ",75320,Male,11883
M89651902,จิฬาภรณ์,ถิรสวัสดิ์,ตำรวจ,1968-05-01,"ขุดท้องฟ้าควรไอศกรีมหมดอินสตาแกรม 
กตัญญูแม้ย่อไชโยฤดูกิน บัดนี้การระยำทดอธิษฐาน โง่ทวิตเตอร์เครื่องบินเหตุ ",75320,Female,8868
441403304,สุทธิณัฐ,พีระเพ็ญกุล,ช่างทำผม,1995-03-11,"การสดชื่นรู้จักองค์คนตาย ได้แก่หน้าที่กำไรงม โกงทานทอดมันวัฒนธรรมแสง 
ชนิดเพราะไชโยทรัพย์สิน น้องชุดนอนเลี้ยวจัดสัญญา ข้าวเจ้าระเบียงขัดกรดไหลย้อนห่มผ้าวิชาชีพ ",88530,Male,12026
U75613560,พัชรีนิษฐ์,ศรีเผด็จ,นักเขียน,1946-12-05,"ความเข้ารหัสทอดมันกระถางเลี้ยวกีฬาประชาธิปไตย น้องเป้าโควิด 
ค่อยตั้งแต่แอนดรอยด์หอย หลงกรรมการนั่งลูกเพลงหึงสาเพดาน แก่เบียร์ลูกตา กว้างปีเขยิบบันไดรอทดเขยื้อน ",22730,Female,8397
O84507613,ศศินา,ดาวอร่าม,นักคณิตศาสตร์,1974-04-14,"ขัดแมลงเจ็บไข้การเช้า ขัดดีทวดเพลง 
ซี่ผลิตอายุสดชื่นหน้าต่างหมี เศรษฐกิจโผล่รถทัวร์คนตาย กว้างปากหน้าต่างโดยหรือ เงาครองแก้ว 
แหย่ปีบูชาแอนดรอยด์เนื้อซ่อมเบิ่ง กำไรแคะค่อย ",21410,Female,8196
A31421079,นิรุตต์,เขียวอ่อน,นักเขียน,1934-12-30,"กบน้ำหวานตะปูร่างหยักร่มรื่นผลโก๋แก่ น้ำหวานเมตตาทดสหกรณ์ รู้จักด้วยเขยิบเคารพเรื่อยกระจาย 
เยอะผิดและพยาธิ เปลืองทดเล่มแต่งคลานถีบตอใด ย่อกะเพราอดโรงสี ",75200,Male,12484
113798869,ปฐวีกานต์,นาควงษ์,นักมายากล,1956-12-07,"เพดานเรื่อยเทเลแกรมยึดเกาหลีอนุบาลอิฐ ไอศกรีมข้าวเจ้าแข้งที่ดินของหวานสหกรณ์ ความจัดหอยกิ่งไม้ 
เตียนไหนทรัพย์สินแรกกามถกเถียงสมาคม แม่มดเพลงจะไปพั่ง กิโลเมตรสดรถโดยสารชูชุดนอนสุขภาพเห็น ",95840,Male,13076
541638661,ภูวิช,ทับทิมไทย,จ๊อกกี้,1990-08-13,"กล่องแกและองค์ รอประพฤติทำสวนสถานีได้แก่ กิ่งไม้น้าแต่สบายหมัด รากปีเรื่อยถกเถียงนิ่มสบายยีราฟ 
สมาคมตับสีเทาเชื่อมกูง่วง ปากขาดเคิ่งบอกธนาคารมัสยิดศาลากลาง คอกชูทดลองแถบแม่มดสมอง ",41560,Female,9712
742712874,ปิยบุตร,ทับทิมไทย,นักแสดง,1970-06-05,"ปูยึดที่ด้วยคอกนิ่ม มะเขือเทศขี่ดีกรดไหลย้อนพับข้าวหมูแดงแก้ว แสงทำสวนครองฝากเริ่ม 
ชุดนอนปิ่นโตควรด้ายนั่ง กลคลานคลานปี่นุ่น แม้ซอยเลี้ยวกะละมังโดย ",57110,Female,10102
634875203,วิกิจ,บุญส่ง,นักดาราศาสตร์,1953-05-26,"เฉยกิ่งไม้แต่งศาลากลางอด ซ่อนน้องแข้งรถบัสแก่ ผ่อออนซอนเด๊กรรมการนักเรียนเจ็บไข้ถางระเบียง 
รอเคยหน้ากากหลงมอบใบไม้ ฤดูแผนที่ได้แก่คบกูสม่ำเสมอข้าว ",41560,Male,14381
M58799076,มนรัตน์,ไทยแท้,นักพจนานุกรม,1939-01-23,"พิการเชื่อมตรวจกีฬา เชื่อมอดห่มผ้าตกลงน้องเศษอาหารบริษัท แม้แมคใหม่หนูอายุใหม่พนมมือ 
เมตตารถทัวร์ลูกชิ้นน้ำเย็นความคอกดำ ดอกไม้แกแลกซอยด้ายแก้ว ",75320,Male,11467
303595540,ผดุงพล,ดาวกระจาย,นักแปล,1937-01-30,ขัดจากเลือกพ่อเศษอาหารสดชื่นใหม่พ่อ ลูกชิ้นสมาคมกลางคืนตื่นระเบียงเสรีนิยมก้าง แรกด้ายสีแดงตำลึงชาวชู ,95840,Female,10553
241463615,อธิตยา,โพธิสัตย์,ช่างทำผม,1970-11-03,"โตข้าวหมูแดงตกลงแผนที่ ตลอดซ่อนชาวนาเป็นทวดทอดมันหึงสา 
สีเทาเครื่องบินโง่ผลิตแท็บลอยด์แม่มดกบสนอง สีขี้ไคลลูกผักคาวหว่านวาดพนมมือ ",41560,Female,9438
E94418488,พีรพัฒน์,ทองสินธุ์,แพทย์,1977-03-20,"น้ำเย็นแจ่มใสสนอง กล้าเย็นชาวกามหยอกเชื่อมดังนี้ข้าว แข้งหยอกย่อระยำ 
หน้าต่างแต่งโน่นลืมคาวริมเชื่อ ห้างเมล็ดเข้ารหัสอวัยวะห้าง ขี้ไคลหน้าต่างเหตุคำถามคบร้อนอวัยวะ ",95840,Female,9313
009604148,ศศิธร,คำลือ,นักการกุศล,2020-02-24,"ด้วยกะละมังวังรังแกทวิตเตอร์โตย แตะเตียนอวัยวะขัดตีนทดลองกับธนาคาร ปากพิพักพิพ่วนจัดค่อยหอย 
หมีไอโอเอสรถถังแม่ยาขาดเคิ่ง ",75200,Female,9199
L86988628,ฟารินี,ผลบุญ,ช่างทำผม,1995-12-12,"เคารพสหกรณ์บูชาแท็กซี่เพดาน ริมเลือกตู่เลี้ยว 
อดเพราะอ่อนหวานกินกล่องสมาคม ระเบียงลูกตาผสมวินโดวส์ กลตับค่อยอบอุ่น 
เนื่องจากไต้ระเบียงอบอุ่นรังแก รสชาติทรัพย์สินองค์งมแมลงวาด ธาตุโกงโดยย้ำ ",88530,Male,13229
T61566726,เจษฏาภรณ์,ธูปะวิโรจน์,เกษตรกร,1938-09-07,"หนุนพิพักพิพ่วนลูกตาเศษอาหารทวดจาก 
โกงในเขยิบการคำสั่งหน้าต่างเพราะ กล่องเลือกหน้ากากแคะกะเพราที่ 
เผื่อห้องเรียนแข่งขันจากนุ่นน้าเพลง ",75200,Male,12388
T90812271,ยุลิน,หอมสิน,ตำรวจ,1912-08-09,โรงสีเขยื้อนผู้ร้ายค่อยแคะวิ่งสาธารณรัฐ หาม้ายกล่องโรงสีอาหารเช้าเรื่อย ซ่อนเย็บผีกหรือเยอะชูทุ่ม ,95840,Male,13409
K62948259,นิติ,พรรษาสกุล,ผู้กำกับละครโทรทัศน์,1998-05-27,"เศรษฐกิจระเบียงแซงหมอกน้องอินเทอร์เน็ต ตัวเมียขนมยีราฟแรกพ่อ ผีกกระถางระยำเทเลแกรมควรสารวัตรเชื้อโรค 
ทอดมันยากิจกรรมขี่ วังย้ำผัก ประพฤติตีนศาลากลางกูเกิล ",41560,Female,10862
Q05213617,พิศพรรณ,ธีวร,คนขับรถแท็กซี่,1967-02-13,"หลังคาสหกรณ์ประพฤติอดตอกเศรษฐกิจกระจาย ริมไต้หวันเรื่อยกลางคืนหอยไอศกรีมสำหรับกล บันไดเริ่มกบมอบสมองมัสยิดรถบัส 
ทรัพย์สินเบียร์เกาหลีถกเถียงนักเรียนซอย โตตู้อนุบาลมลายูคู่ ",22730,Female,10186
473387187,ราชพฤกษ์,บัวเผื่อน,นักโบราณคดี,1971-01-30,ดาวเทียมร่างกายขี้ดินแข่งขันไอโอเอส คาวตู่หนุนข้าวหมูแดงบัดนี้ทุกข์หลง ทดซ่อนงมฉีดเอสซีบี ,66330,Male,12551
T51550064,อำไพ,ดาตู,เจ้าหน้าที่รัฐบาล,1962-06-15,"กะละมังปากขุดตั้งแต่ นั่งอิฐอัศจรรย์ แผนที่ปีประชาธิปไตยต้นกรดไหลย้อนติด 
ตำลึงคบยายึดทำสวนจ๋าเพราะ ผิดเผื่อมลายูรสชาติและ พนมมือชูกะเพรากตัญญูพยาธิริมหาบสถานี ",21410,Male,12114
T63330307,อารีย์,หิรัญสาลี,นักพจนานุกรม,2011-05-13,"คนตายอายุแคะแสงผสมฝาก ดองคาวผักตรวจ จากพักผ่อนไอศกรีมไข่อิฐกล่าวเล่มเชื่อ ใหม่ร่างกายหมีชิงห่มผ้าสถานี 
อิสลามตกลงแซงเพดาน หม้อหมอกตีนเข้ารหัสกะละมังที่ ",41560,Female,9828
090250204,หฤทัย,นาควงษ์,ผู้จัดพิมพ์,1958-01-01,"ดำแอนดรอยด์ทั่วสถานีเขยื้อนอนุบาล ร่างเครื่องบินสดบาดแก้กลางและบูชา 
ห้องเรียนเพลงแม่มดคู่เพราะห้องเรียน ประพฤติเยาวชนขันน้ำหนูซี่เช้าอนุบาล ครูคู่อนุบาลกับด้วย ",22730,Male,11031
519828602,ชนิศา,เนื่องนนท์,จ๊อกกี้,1977-02-08,"ครูแตะนักเรียนบัดนี้อาสาชาวนา 
เรื่อยทานประชาธิปไตยกว้างสถานี กลางคืนกลางสำหรับไต้หวันเงา 
เขยื้อนเตียนตื่นสดท้องฟ้าโน่นเกมนักเรียน หมอกหุ้มรสชาติสีเลือกสีเทา 
ตัวเมียอ่อนหวานบูด ",88530,Male,13454
533761548,ถนอมชัย,จันทา,นักการศึกษา,1996-05-29,"ธนาคารทานกับเพียงยูทูบรัฐบาล คอกปูสาธารณรัฐร่มรื่น ขี้ดินดังนี้นักเรียนหนุน 
แก้วแพ้สมาคมทานเพดานเกาหลีเช้า รัฐประหารองค์ผีกตั้งแต่ ",75320,Female,11390
X09105300,ทานตะวัน,ทองสุกเลิศ,เจ้าหน้าที่รัฐบาล,1920-07-30,"ขุดรังแกกลางไอโอเอสห่อข้าว เกาหลีสำนักงานผ่อปีคั่วสี 
แหย่เล่มด้ายเสรีภาพ เหตุน้าหาม้ายกับผ่อเข้ารหัสกล่อง ไต้ขาดเคิ่งไชโยตำลึงต่อ ",75320,Male,11044
O05007115,ชิดชนก,ถนัดอักษร,นักพจนานุกรม,1974-02-23,"ทานค่อยผลิตหลังคา วิชาชีพแผนที่ธาตุขี้ไคล วิชาชีพแถบยีราฟขันน้ำคอกแข็งบูดยูทูบ 
ชุมนุมไข่ปกครองศาลากลางผลัดผักโควิด ปูชนิดสนองกล้าบัดนี้บูชา ",98860,Female,10260
084662514,ธราวิทญ์,สงประเสริฐ,นักการศึกษา,2006-10-01,"กิ่งไม้ค่อยหม้อ ทอดหมอกทดอินเทอร์เน็ตทาน 
ห้างผลหรือขนมชั้นอินสตาแกรม หึงสาคอกฟากกล่าวสนองตัวเมีย 
เย็บสำนักงานเครื่องบินกำไรลูกตา สีตั้งแต่กลางเยาวชนพนมมือ ",41560,Male,11738
732355875,แปลง,ทหารแท้,เจ้าหน้าที่รัฐบาล,2015-10-22,"แกคู่เขยิบตะปูง่วง คำถามกลแต่ผีกบอกโรงสีเริ่ม 
แอนดรอยด์อินสตาแกรมในปกครองขาดเคิ่งชนิด แกบอกใบ้โง่จัดดาวเทียมตอใดไค้หัน ตะปูเผื่อสำหรับหน้ากากนักเรียนแมคนั่ง ",75200,Male,12831
433756611,อันธิกา,ทับทิมไทย,นักสัตววิทยา,1994-09-09,"ชะนีแรกแมลงโง่อาสา 
อิฐคำสั่งอนุบาล ใบไม้อบอุ่นตกลง 
หมีเหตุรู้จักรถบัส หม้อชาวเชื้อโรคก้างน้ำหวานคำถามชะนี สหกรณ์หมัดหมีแก้ว ตัวเมียศาสตร์กลางลูกชิ้นหยักเชื้อโรคเตียนเล่ม ",95840,Female,9144
O02107352,ปิยนาฎ,ถาวรายุศม์,ผู้กำกับละครโทรทัศน์,1952-09-08,"ผลที่รอห้องเรียนตีนอธิษฐานวิกิพีเดียขันน้ำ ถีบกะเพรากิโลเมตรซี่ตอกเตา 
ข้าวหมูแดงเลี้ยวไข่ชุมนุม ชะนีข้าวหมูแดงตรวจโดยกระถางกูทวิตเตอร์ 
พิการขี้ไคลขนมสัญญาจ๋า โตยลืมคาวสีเทาย้ำฟากกลางคืนชนิด ",57110,Male,11643
034460292,โสภณิตา,ตัณสถิตย์,นักเขียน,1986-07-25,"มัสยิดธาตุหล่นชาวนาแลก ยีราฟกูเกิลชิงแก้เจ็บไข้โดย 
กลางคืนลงมือลูกชิ้นดูฟากสถานีซี่ ชะนีกล้าแถบหน้ากากสม่ำเสมอโผล่จัดโกง ",41560,Male,13743
I23904515,เนติลักษณ์,นุ่มกัน,นักแสดง,1966-04-10,"อัศจรรย์ผลิตหมุนกบ อินเทอร์เน็ตผลิตเดี่ยวผ่อหาม้ายอิฐไอโอเอส กูเกิลรถถังกินกตัญญู 
แก้วชะนีห้องเรียนหาม้ายใหม่ สารวัตรเพียงย่อ หน้าต่างเย็นคั่วระยำสหกรณ์ 
ขี่ไข่ใจคอมมิวนิสต์เศรษฐกิจหยอกเพราะจ๋า ",75320,Female,9965
