passport,first_name,last_name,job,date_of_birth,comment,postcode,gender,spending
E23433640,แปลง,ตรีครุธพันธุ์,นักแปล,1915-05-13,"เป้าไต้หวันมัสยิดแก สบายที่วัฒนธรรม อดเดี่ยวรัฐบาล 
อิฐผลิตหมัดมลายูรัฐบาล ยันร่มรื่นกล่องเทเลแกรมน้ำหวานอิฐเผื่อ เยอะห่วงใยเงาซ่อน ",21410,Female,10357
774359944,ธัญญามาศ,ทหารแท้,นักประวัติศาสตร์,1910-03-26,"คลานชนิดหว่านเกม อวัยวะทุ่มแมลงอิฐ 
มิตรสถานีสหกรณ์ตัวอย่างทุ่ม ครองลูกหลงหล่นอิฐเอสซีบีไชโย 
รสชาติคาวทวดซ่อนเสรีภาพดี ชาวนาลูกตาร่างกายสำหรับกิ่งไม้ เยอะคอกวัฒนธรรมปีโรงสีตื่น ",41560,Male,11969
562054086,ปัญญาพร,หนุนสุข,คนขับรถแท็กซี่,1980-08-08,"ผลิตหยักขาดเคิ่งทหาร จากชนิดผู้ร้ายต่ออนุบาลศาสตร์ 
ดีพนมมือผลิตคนตาย ตื่นรสชาติแปรง ศาลากลางเย็บครองงมลูกฉีดครู 
รัฐประหารดึกสถานีแจ่มใสหมุนแก้ 
สถานีสลับใบไม้เมตตาเลี้ยวห้องเรียนวินโดวส์ ",98860,Male,11042
033889561,ชัชเวศย์,บุณยะภาชน์,นักสังคมศาสตร์,2006-07-12,"ดีปีถึงกตัญญูร่มรื่นไข่ เศรษฐกิจหยอกเตียนตัวอย่างดี หน้าต่างหยอกตู่กูเพราะ 
อาหารอัศจรรย์เกมลงมือเฉยฝากตู้ กตัญญูหุ้มไค้หันตื่น ถกเถียงไข่เงาพ่อ ",57110,Female,10341
L73013797,อรจิรา,ทองเนื้อดี,ผู้กำกับภาพยนตร์,1985-11-11,"ฝากข้าวหมูแดงกีฬานิ่มแก้วประพฤติ ลงมือเฉยหึงสาเคเอฟซีชิงเศษทดลอง 
ไอศกรีมจัดขุดตลอดเบียร์ ร่างกายสดชื่นผลร่มรื่นเจ็บไข้ย่อสดชื่น ",98860,Male,11056
355638980,พิมพ์สุดา,นิระหานี,คนขับรถแท็กซี่,1954-10-15,"ยูทูบซี่อินสตาแกรมขันน้ำของหวาน เกาหลีวิกิพีเดียแจ่มใสติดกำไรโกง ชูแม่กะละมังกะเพราผล 
ท้องฟ้าชูห่มผ้าเกาหลีห้องเรียนห่วงใยกว้างสุดท้าย 
ยูทูบผักศิษย์เพดานแข้งทดลอง แลกใหม่ห่มผ้าปู 
ตู้ขัดสมองคนไข้ ",88530,Male,12394
K20223780,สุภาพร,ถนัดการยนต์,ผู้จัดพิมพ์,1961-08-31,"ตรวจมลายูนิ่มหน้าที่อวัยวะกิ่งไม้ รากผักผัก 
ข้าวตื่นสถานีกีฬาที่ดินแถบ อายุข้าวมอบแม่แซงกีฬาหมด ข้างตะปูครองเมตตาโดยลูกตาหุ้ม 
อิฐเย็บทดเข้ารหัสเมตตาย่อ ดึกตอกต้นออนซอนเด๊ หมีแตะกำกล่าว ",88530,Female,9557
130985931,ปัตถพงษ์,มิ่งขวัญ,นักการศึกษา,1947-06-27,"แรงงานโก๋แก่ล่อตะแกรงและที่ดินหนู ร่างกายปี่ไข่กูเกิลขุด 
ไอโอเอสสมาคมไชโยแตะไข่ สีหุ้มถกเถียงด้วยถกเถียงถึง 
ต่อแข้งถึงเพดานและ ลืมคาวพยาธิแข็งขี้ไคล ไอศกรีมใหม่เกาหลีกระถาง ",75320,Male,13712
953719214,บุญญกัลป์,ตะละภัฏ,นักเขียน,1999-09-15,"ทอดแต่งตำลึงน้องงมตะปู กล่าวมิตรไหนหอยโน่นล่อนุ่น 
เขยิบกว้างผู้ร้าย ไค้หันเอสซีบีพักผ่อนเรียงอัศจรรย์ วิ่งคำสั่งสี 
เรียงคนไข้ห้องเรียน ",98860,Female,7792
R47673589,พัชรพร,นกทอง,ศิลปิน,1916-11-02,"สหภาพทานตู่แผนที่ตับชนิด ระเบียงกิโลเมตรกูสมองกระจายผลิตสีเทา พิพักพิพ่วนคั่วชู 
เคยโง่ยึดล่อระยำตอใดง่วง ",22730,Male,11002
724750165,ภัคชนน,ร่มธิติรัตน์,นักสัตววิทยา,1974-12-09,"คอมมิวนิสต์ศาสตร์ตัวเมียหลง ใหม่ไค้หันกิจกรรมประพฤติชนิดเกม บาดกล่าวลูกตาทุกข์ร่างห่อข้าว 
อาหารกะละมังหยักสลับ สมาคมเหตุหายทรัพย์สินแรก ฤดูนักเรียนกูร่มรื่น ",57110,Female,9232
930082901,ภัคชัญญา,เดชวา,นักคณิตศาสตร์,1986-08-05,"สถานีมลายูศาลากลางหมัดสีเทาโตย 
รู้จักเศษชาวนาดูชาวหน้าที่โง่ ทั่วสนองกระถางหมีนุ่นแก แข่งขันถึงเกมน้ำเย็น 
แก้เขยิบโควิดบริษัทผล พยาธิบูดฉีดจัดเอสซีบีเคเอฟซีดอกไม้ ช้าเจ็บไข้ทหารดึกดำผลัด ",41560,Female,9414
D49212672,เทียมศักดิ์,นิลเสนา,ผู้จัดพิมพ์,1965-06-05,"ความแมคลูกตาที่ดินเสรีนิยมชิงแมลง ติดบาดหนุนรู้จักเย็นปี 
น้องชุดนอนเสรีภาพเปลือง ซ่อนเป็นหุ้มพิพักพิพ่วน 
เช้าแข้งแก้วจ๋าดาวเทียมแปรง เมาะยันซ่อนหมัด ตับอธิษฐานห่มผ้าคำสั่งสลับชุดนอน ",41560,Female,12580
735924216,พรสวรรค์,บุนยะตีรณะ,นักการกุศล,1931-06-03,"หมอกแจ่มใสเจ็บไข้ซ่อนสุดท้ายฤดูหล่นทรัพย์สิน หมัดสัญญาฉีดรออัศจรรย์ 
อินเทอร์เน็ตยันเคารพทรัพย์สิน ลืมคาวแอนดรอยด์โตยตัวอย่าง ",98860,Male,12689
493224290,เกริกพล,นักสำหรวจ,นักแสดง,1933-05-06,"หว่านปกครองจัดกลางคืนทหารเปลืองคู่ ได้แก่อบอุ่นธนาคารประสบการณ์เนื่องจากอาหาร 
โผล่ชนิดในคอก แต่สหภาพถกเถียง ก้างศาลากลางสาธารณรัฐห่มผ้าโดยตะปู ",75200,Male,12368
W47575257,เทพณรงค์,ด้วงโสน,ภัณฑารักษ์,2009-01-29,"สบายอ่อนหวานข้าวเจ้า วิกิพีเดียยีราฟค่อยชู 
ซี่หุ้มนักเรียนหรือตลอดครอง กว้างสมาคมเกาหลีแต่นิ่มไหนเยอะ ",75320,Male,10462
968792598,นภัสรินทร์,ทัศนสุทธิ,ผู้จัดพิมพ์,1950-03-07,"วาดเจ็บไข้สัญญา ข้าวในเกมทุ่มหน้าต่างยา เฟซบุ๊กกล่าวร่างเทเลแกรม ระยำตัวเมียทดจัดปีรู้จักก้างเศรษฐกิจ 
โง่หึงสาแข้งครองกรรมการหมัด ",22730,Female,9848
468086667,อัญพัชร์,ศิวะวรเวท,นักการศึกษา,1965-08-20,"เผื่อฝากเศษ ด้ายอายุแถบแม่มดจะไปพั่งห่อข้าวสำนักงาน 
โง่คู่หมัดชาวไอโอเอส คนไข้ตัวอย่างแม้รถถังเมตตาเชื่อม 
กิโลเมตรดอกไม้ขัดเมตตาวินโดวส์ ด้ายใจโน่น ไอโอเอสเชื่อมผิดเบียร์ ",66330,Male,11966
E78701570,พรชนก,ติระคมน์,นักโภชนาการ,1993-01-08,"ช้าซอยปี่เกาหลีเพียง ฟากหลังคาแม่ท้องฟ้าแท็บลอยด์โง่ 
รอที่โกงดำทวดบันไดทอดมัน แก่โผล่ยึด แท็บลอยด์แข่งขันศิษย์สม่ำเสมอเคเอฟซีเย็น 
แม่มดตอใดล่อทานเชื่อแม่ปาก ปากตู้สลับตำลึงเยาวชนหว่านเขยิบ ",21410,Female,12570
R04776348,พิมพ์พิชญา,ทรงโกมล,ผู้กำกับภาพยนตร์,1971-06-30,"หอยระเบียงเสรีนิยมกูกตัญญู ห่มผ้าโรงสีห่อข้าวเริ่ม 
ตะแกรงก้างแก่เลี้ยวคนไข้ทหาร ปีหยอกแปรงที่ศาลากลางโตโรงสีฝาก 
ก้างร้อนเป็นอาหารดึก ",95840,Female,10532
Q76202011,นรีรัตน์,ชุมวระ,ผู้กำกับภาพยนตร์,1910-06-19,"หน้ากากบูชาเศรษฐกิจช้า เมล็ดหลบร่าง ผู้ร้ายแต่ขันน้ำอนุบาลขี้ดินสหภาพ 
เนื่องจากไค้หันทวดกับเย็บกะละมังกิโลเมตร อ่อนหวานไข่ตรวจหลงชะนีปกครองแผนที่ ",21410,Male,10943
841068437,เจตพินิษฐ์,ถนัดอักษร,นักโบราณคดี,1963-10-14,"ตัวอย่างค่อยที่ดินตัวอย่างมะเขือเทศคำถาม กิจกรรมหล่นประชาธิปไตยสุขภาพไต้หวัน 
นักเรียนตัวเมียไต้ช้าเย็บหม้อแม่ทวด ยาชาวนาเหตุคนตายสาธารณรัฐห่มผ้าชิง เล่มปากวาดเข้ารหัส ",88530,Male,12639
851183858,พศร,ไทยแท้,ผู้กำกับภาพยนตร์,1926-08-04,"ตะปูกล่าวอวัยวะสดหน้ากาก 
สุดท้ายชาวเชื่อมเอิดแตะปิ่นโตรถบัส เกาหลีตรวจอินเทอร์เน็ตมอบวินโดวส์ วิชาชีพกีฬายา 
คลานบูดแก้อัศจรรย์ชะนีเนื้อแตะระยำ ยีราฟเชื่อหลังคาเห็นแลกจะไปพั่ง ใจปูมอบร้อนถีบ ",41560,Female,8530
I80392627,ชิดชนก,ดาบเงิน,บรรณารักษ์,1978-03-13,"เอสซีบีได้แก่ผ่ออาหารปูสาธารณรัฐซ่อน หาม้ายแซงพยาธิเลือกตะปูถีบทอด 
ดอกไม้ยันแข็งคมนาคมมอบแพ้ตลอด พักผ่อนที่ดินหมุนบูดเสียบ รถโดยสารโดยเคยบัดนี้พับถึงหนู 
รัฐบาลห่วงใยพนมมือ เปลืองซี่ฤดูไข่ปิ่นโต ",75200,Female,8776
388711480,อัญชิษฐา,นครเทพ,นักโบราณคดี,1952-05-11,"เศษอาหารตัวเมียซี่ปูครูเกาหลีแผนที่ ธนาคารเริ่มกะละมังการเปลืองสหกรณ์ซ่อน ในสีเทากามกลางเศษอาหารดีความ 
กล้าถึงชูเชื่อทวด สารวัตรสนองแข็งหล่นสีทรัพย์สินหม้อ ตรวจก้างเกาหลีเสรีนิยมยาเหตุเมตตา ",75200,Male,12556
F61718450,พันเกล้า,โพธิสัตย์,นักการทูต,2006-10-09,"กำหาม้ายแต่เยอะ น้ำเย็นสบายพักผ่อนทานโน่น เจ็บไข้ออนซอนเด๊คนไข้ปูเขยื้อนเดี่ยวบอก 
น้องนักเรียนเป้าเดี่ยววิ่ง หมอกแซงธนาคารสหกรณ์ ",41560,Male,13463
V46909029,บุญเอก,ทองปากน้ำ,ผู้กำกับละครโทรทัศน์,1960-04-09,"เป้าดีห่มผ้าอธิษฐานโง่ ตรวจเนื้อน้องฝาก 
ฝากแต่บันไดหนุนกล ไชโยผสมกิ่งไม้เนื้อหมัด อิฐห่มผ้าตู่ไค้หันแรงงาน 
เศษอาหารยีราฟเคยเศษตั้งแต่ ทดตอกทหารเงา ",21410,Female,10021
J26506485,สุภาพร,แหยมศิริ,นักแสดง,2018-08-21,"ตั้งแต่เขยื้อนผ่อดังนี้เชื่อทหารเศษ 
แก้ดังนี้หายผลัดกะละมัง ลูกตาเพดานคำสั่งแมคกล่อง รากกลางมอบแหย่ 
สมองตับไข่ปากสนองสุดท้าย กำไรมอบขาดเคิ่งกะละมังคอกเริ่ม ร่มรื่นแต่หล่นเช้าอธิษฐานคู่ชุมนุม ",66330,Male,11634
C75025789,ประไพพักตร์,ขุนดำ,นักการกุศล,1988-04-17,"หน้าต่างข้าวหนุน ที่หนูตู่จัด พับกระถางร่มรื่นกิโลเมตร 
คู่ไอศกรีมอวัยวะเนื้อลูกชิ้นอนุบาลขนม บูดเจ็บไข้วิชาชีพครูทวด 
ตลอดยีราฟน้ำเย็นเล่มทั่วอดพนมมือ เข้ารหัสเครื่องบินซี่เรียง สนองและขัดลูกตาโต ",57110,Female,10587
249599061,นาวีตา,แหยมศิริ,นักการกุศล,2005-12-29,"โตยแจ่มใสลูกเกมลูกตากูเกิล สีหาม้ายผักกินปกครอง 
น้องเลี้ยวเพดานนักเรียน อินสตาแกรมดีอินเทอร์เน็ตเสรีนิยมแก้วห่มผ้าทดกล่อง รถโดยสารพิการชิงสีเทา ",41560,Male,11324
436191293,ไชยภพ,แก้วชลคราม,เกษตรกร,1918-01-06,"ในบูดตู่ ซี่ชิงวังย้ำปิ่นโตมะเขือเทศ กูพนมมือเชื่อห่มผ้ายึดเตารถถัง 
ผีกปูโกงสหกรณ์พักผ่อนเห็นหล่น หึงสากระจายแสงรถบัสยึดชู คาวเปลืองกลฝากค่อยหม้อคำสั่ง ",21410,Male,10456
987618305,เพ็ญพรรษา,นับเนื่องนอ,นักพจนานุกรม,1980-09-03,"โควิดสบายตกลงมิตร เยอะลงมือดังนี้ 
ขาดเคิ่งดอกไม้นั่งคำถามเมล็ดกลหุ้ม ชะนีหมุนหมัดผลรอ ลูกตาธนาคารคำสั่งหมัด 
เครื่องบินงมจัดพยาธิอบอุ่น ",21410,Male,11253
K40700162,ราชพฤกษ์,นพตระกูล,นักสังคมสงเคราะห์,1981-12-20,"ย้ำรอทอดมันประสบการณ์อิฐเรียงของหวาน หล่นโรงสีเชื้อโรคกตัญญู ดอกไม้วาดชาวนาหรือกลหาย โตยข้าวหมูแดงเย็บปี่เยาวชนเป็น 
บูชาศาสตร์ใจแกะสมองย่อ ห่อข้าวหาม้ายเย็บ ดองลูกชิ้นผิดแต่งจากตื่นได้แก่ ",75200,Female,11715
824041518,ธีราทัต,บุตราช,นักสังคมสงเคราะห์,1910-07-05,"คะแนนหมอกในน้าควรบัดนี้หุ้ม แข่งขันแต่งสดกตัญญู คอมมิวนิสต์มะเขือเทศผีกชุมนุมเฉยแม่พยาธิ 
ความหน้าที่บริโภคด้วยลูกคอมมิวนิสต์ หลงรสชาติตับ กตัญญูล่อหมอกบริโภคยูทูบ ",75320,Female,10579
X78952543,สิริลัดดา,ภูภักดี,ผู้จัดพิมพ์,1945-11-29,"ความทอดมันประพฤติตะแกรงสดชื่นหึงสาสหภาพ สดชื่นสลับสลับกิจกรรมคมนาคมแจ่มใส สม่ำเสมอคะแนนแม่มดแกะแม่มด ทหารซี่หาบหมัด 
สำหรับพนมมือแคะหยัก อุปโภคบันไดเข้ารหัสหมัดริมแข่งขันแม้ ",88530,Female,10828
K50176243,จิตตานันท์,นวลเพ็ง,นักการทูต,2015-01-10,"เขยิบเขยิบเศษอาหารเผื่อรสชาติเคยเป้ากิ่งไม้ ตรวจไชโยคบ เศษอาหารโก๋แก่ตัวเมียเป้าห้างดึก 
เจ็บไข้เมตตาขนมชั้นกลางแข่งขันพับแปรงสถานี แม้แม้กรรมการฟากถีบเมตตากู ทรัพย์สินเนื้อมลายู ",57110,Female,9607
P73854545,ปิยบุตร,ทองแท้,นักประวัติศาสตร์,1919-05-24,"ทอดวิ่งด้ายหมัด วาดหล่นรังแกกบเศษอาหาร ของหวานเยอะเข้ารหัสโผล่พักผ่อน ยาคำถามเพดานท้องฟ้า 
บัดนี้คอกจัดยาโรงสียาบูด เย็บกลหมุนบัดนี้กว้างกิน ",22730,Male,12553
F21805732,วรรณกร,นิษประปัญจ์,นักการกุศล,2000-05-15,"ของหวานเพราะยาด้วย แจ่มใสธนาคารใจแข้งยีราฟคลาน คาวเสียบมะเขือเทศสีเทาผลิตดีเคย 
ธาตุดาวเทียมน้ำหวานวิกิพีเดียถางชาวนา พ่อมิตรผลัดย้ำงมตู้กลาง ",98860,Male,13207
113907206,เฉลิมรัตน์,เดชวา,นักโภชนาการ,1967-07-13,"กำกระจายสุขภาพสำนักงานลงมือหว่านเมตตา 
หยักชิงยีราฟสำหรับคาวออนซอนเด๊ สดหลงพิพักพิพ่วนหาม้ายพิการใบไม้ ",95840,Male,12451
B30338871,สุภัทริดา,นานายน,นักพจนานุกรม,1932-12-28,"แกะสำหรับตั้งแต่กตัญญูไชโย ย่อตรวจกรดไหลย้อนห่มผ้าถึงสัญญา บริษัทใหม่มะเขือเทศข้าวไต้หวันห้องเรียน 
ย้ำหยอกใบไม้ จ๋าแผนที่มะเขือเทศทวิตเตอร์ 
ทำสวนขนมจ๋าข้าวบันไดหลังคา ",66330,Male,12237
835152901,ศรายุธ,บุนยะศัพท์,นักสังคมสงเคราะห์,2021-06-08,"แมคตู้ท้องฟ้าฉีดหลงครูไชโยขี้ดิน คนไข้กระถางกามดอกไม้ ห่มผ้าวิ่งอบอุ่นบูชาหมีสุขภาพ 
ตัวเมียตื่นคำสั่งประพฤติหน้าต่างชะนีเป้า ห่วงใยหมดตัวเมียงมเศษอาหารซอยจ๋า ",41560,Female,7981
G52891604,ปริญญา,ธรรมนิยม,นักสังคมสงเคราะห์,1975-01-18,"ปกครองรถโดยสารหลงมลายูพักผ่อนที่ดินแต่ง ต่อเอิดรถโดยสารพักผ่อนเพียงกีฬา สำนักงานอาสาโตยหลบไค้หันหนู 
ดังนี้ชุมนุมแข่งขันตัวเมียอวัยวะเกม ",88530,Female,8470
B40179194,ภูวฤณ,ศาสตร์ศิลป์,นักดาราศาสตร์,1999-01-10,"แลกคาวชาวนากะละมังแท็บลอยด์ เยอะไต้หวันแก่หยักเชื่อม ถกเถียงขี่กินถกเถียงกรดไหลย้อนเห็น 
ขี้ดินดึกหนูหลังคารัฐบาลดองทุกข์ น้ำเย็นออนซอนเด๊นักเรียนชาวนาแตะครูแอนดรอยด์ ปีบริโภควิชาชีพวิชาชีพแพ้กำ ",41560,Female,11131
